{
  "schema_version": 1,
  "id": "test.story-beta",
  "name": "Story Beta",
  "version": "0.5.0",
  "type": "story",
  "engine_api": 0,
  "license": "CC-BY-SA-4.0",
  "attribution": ["Story Beta by the tests"],
  "supported_modes": ["gritty"],
  "max_descriptors": {},
  "dependencies": [{"id": "test.story-alpha", "version": "^2.0"}],
  "story": {"map": "code430.ottawa-centretown"},
  "content": [{"type": "ads", "path": "ads.v0.json"}]
}
